{
  "id": 23,
  "title": "Merge k Sorted Lists",
  "difficulty": "Hard",
  "company": [
    "Meta"
  ],
  "tags": [
    "Linked List",
    "Divide and Conquer",
    "Heap (Priority Queue)",
    "Merge Sort"
  ],
  "description": "You are given an array of `k` linked-lists `lists`, each linked-list is sorted in **ascending order**.\n\nMerge all the linked-lists into one **sorted linked-list** and return it.\n\n### Example 1\n\n**Input:** `lists = [[1, 4, 5], [1, 3, 4], [2, 6]]`  \n**Output:** `[1, 1, 2, 3, 4, 4, 5, 6]`  \n**Explanation:** The linked-lists are:\n```\n[\n  1->4->5,\n  1->3->4,\n  2->6\n]\n```\nmerging them into one sorted list:\n```\n1->1->2->3->4->4->5->6\n```\n\n### Example 2\n\n**Input:** `lists = []`  \n**Output:** `[]`\n\n### Example 3\n\n**Input:** `lists = [[]]`  \n**Output:** `[]`",
  "languages": {
    "python": {
      "starterCode": "# Definition for singly-linked list.\nclass ListNode:\n    def __init__(self, val=0, next=None):\n        self.val = val\n        self.next = next\n\ndef merge_k_lists(lists):\n    \"\"\"\n    :type lists: List[ListNode]\n    :rtype: ListNode\n    \"\"\"\n    # Your code here\n\n\n# Helper function to create a linked list from a list\ndef create_linked_list(lst):\n    dummy = ListNode(0)\n    curr = dummy\n    for val in lst:\n        curr.next = ListNode(val)\n        curr = curr.next\n    return dummy.next\n\n# Helper function to convert linked list to list for printing\ndef linked_list_to_list(head):\n    result = []\n    while head:\n        result.append(head.val)\n        head = head.next\n    return result\n\n# Test cases\nlist1 = create_linked_list([1, 4, 5])\nlist2 = create_linked_list([1, 3, 4])\nlist3 = create_linked_list([2, 6])\nmerged = merge_k_lists([list1, list2, list3])\nprint(linked_list_to_list(merged))  # Should return [1, 1, 2, 3, 4, 4, 5, 6]\n\nprint(linked_list_to_list(merge_k_lists([])))  # Should return []\nprint(linked_list_to_list(merge_k_lists([create_linked_list([])])))  # Should return []"
    }
  }
}