{
  "id": 30,
  "title": "Number of Islands",
  "difficulty": "Medium",
  "company": [
    "Meta"
  ],
  "tags": [
    "Array",
    "Depth-First Search",
    "Breadth-First Search",
    "Union Find",
    "Matrix"
  ],
  "description": "Given an `m x n` 2D binary grid `grid` which represents a map of `'1'`s (land) and `'0'`s (water), return the number of **islands**.\n\nAn **island** is surrounded by water and is formed by connecting adjacent lands horizontally or vertically. You may assume all four edges of the grid are all surrounded by water.\n\n### Example 1\n\n**Input:**\n```\ngrid = [\n  [\"1\", \"1\", \"1\", \"1\", \"0\"],\n  [\"1\", \"1\", \"0\", \"1\", \"0\"],\n  [\"1\", \"1\", \"0\", \"0\", \"0\"],\n  [\"0\", \"0\", \"0\", \"0\", \"0\"]\n]\n```\n**Output:** `1`\n\n### Example 2\n\n**Input:**\n```\ngrid = [\n  [\"1\", \"1\", \"0\", \"0\", \"0\"],\n  [\"1\", \"1\", \"0\", \"0\", \"0\"],\n  [\"0\", \"0\", \"1\", \"0\", \"0\"],\n  [\"0\", \"0\", \"0\", \"1\", \"1\"]\n]\n```\n**Output:** `3`",
  "languages": {
    "python": {
      "starterCode": "def num_islands(grid):\n    \"\"\"\n    :type grid: List[List[str]]\n    :rtype: int\n    \"\"\"\n    # Your code here\n\n\n# Test cases\ngrid1 = [\n  [\"1\",\"1\",\"1\",\"1\",\"0\"],\n  [\"1\",\"1\",\"0\",\"1\",\"0\"],\n  [\"1\",\"1\",\"0\",\"0\",\"0\"],\n  [\"0\",\"0\",\"0\",\"0\",\"0\"]\n]\nprint(num_islands(grid1))  # Should return 1\n\ngrid2 = [\n  [\"1\",\"1\",\"0\",\"0\",\"0\"],\n  [\"1\",\"1\",\"0\",\"0\",\"0\"],\n  [\"0\",\"0\",\"1\",\"0\",\"0\"],\n  [\"0\",\"0\",\"0\",\"1\",\"1\"]\n]\nprint(num_islands(grid2))  # Should return 3"
    }
  }
}