{
  "id": 17,
  "title": "Palindrome Number",
  "difficulty": "Easy",
  "company": [
    ""
  ],
  "tags": [],
  "description": "Given an integer `x`, return `true` if `x` is a **palindrome**, and `false` otherwise.\n\nAn integer is a palindrome when it reads the same forward and backward.\n\n### Example 1\n\n**Input:** `x = 121`  \n**Output:** `true`  \n**Explanation:** `121` reads as `121` from left to right and from right to left.\n\n### Example 2\n\n**Input:** `x = -121`  \n**Output:** `false`  \n**Explanation:** From left to right, it reads `-121`. From right to left, it becomes `121-`. Therefore it is not a palindrome.\n\n### Constraints\n\n- `-2^31 <= x <= 2^31 - 1`",
  "languages": {
    "python": {
      "starterCode": "def is_palindrome(x):\n    # Your code here\n    pass\n\n# Test cases\nprint(is_palindrome(121))    # Should return True\nprint(is_palindrome(-121))   # Should return False\nprint(is_palindrome(10))     # Should return False"
    }
  }
}