{
  "id": 26,
  "title": "Merge Sorted Array",
  "difficulty": "Easy",
  "company": [
    ""
  ],
  "tags": [
    "Array",
    "Two Pointers",
    "Sorting"
  ],
  "description": "You are given two integer arrays `nums1` and `nums2`, sorted in **non-decreasing order**, and two integers `m` and `n`, representing the number of elements in `nums1` and `nums2` respectively.\n\nMerge `nums1` and `nums2` into a single array sorted in **non-decreasing order**.\n\nThe final sorted array should not be returned by the function, but instead be stored inside the array `nums1`. To accommodate this, `nums1` has a length of `m + n`, where the first `m` elements denote the elements that should be merged, and the last `n` elements are set to `0` and should be ignored. `nums2` has a length of `n`.\n\n### Example 1\n\n**Input:** `nums1 = [1, 2, 3, 0, 0, 0]`, `m = 3`, `nums2 = [2, 5, 6]`, `n = 3`  \n**Output:** `[1, 2, 2, 3, 5, 6]`  \n**Explanation:** The arrays we are merging are `[1, 2, 3]` and `[2, 5, 6]`. The result of the merge is `[1, 2, 2, 3, 5, 6]`.\n\n### Example 2\n\n**Input:** `nums1 = [1]`, `m = 1`, `nums2 = []`, `n = 0`  \n**Output:** `[1]`  \n**Explanation:** The arrays we are merging are `[1]` and `[]`. The result of the merge is `[1]`.\n\n### Example 3\n\n**Input:** `nums1 = [0]`, `m = 0`, `nums2 = [1]`, `n = 1`  \n**Output:** `[1]`  \n**Explanation:** The arrays we are merging are `[]` and `[1]`. The result of the merge is `[1]`. Note that because `m = 0`, there are no elements in `nums1`. The `0` is only there to ensure the merge result can fit in `nums1`.",
  "languages": {
    "python": {
      "starterCode": "def merge(nums1, m, nums2, n):\n    \"\"\"\n    :type nums1: List[int]\n    :type m: int\n    :type nums2: List[int]\n    :type n: int\n    :rtype: None Do not return anything, modify nums1 in-place instead.\n    \"\"\"\n    # Your code here\n\n\n# Test cases\nnums1 = [1, 2, 3, 0, 0, 0]\nmerge(nums1, 3, [2, 5, 6], 3)\nprint(nums1)  # Should print [1, 2, 2, 3, 5, 6]\n\nnums2 = [1]\nmerge(nums2, 1, [], 0)\nprint(nums2)  # Should print [1]\n\nnums3 = [0]\nmerge(nums3, 0, [1], 1)\nprint(nums3)  # Should print [1]"
    }
  }
}