{
  "id": 24,
  "title": "Binary Tree Right Side View",
  "difficulty": "Medium",
  "company": [
    ""
  ],
  "tags": [
    "Tree",
    "Depth-First Search",
    "Breadth-First Search",
    "Binary Tree"
  ],
  "description": "Given the `root` of a binary tree, imagine yourself standing on the **right side** of it, return the values of the nodes you can see ordered from top to bottom.\n\n### Example 1\n\n**Input:** `root = [1, 2, 3, null, 5, null, 4]`  \n**Output:** `[1, 3, 4]`\n\n### Example 2\n\n**Input:** `root = [1, null, 3]`  \n**Output:** `[1, 3]`\n\n### Example 3\n\n**Input:** `root = []`  \n**Output:** `[]`",
  "languages": {
    "python": {
      "starterCode": "# Definition for a binary tree node.\nclass TreeNode:\n    def __init__(self, val=0, left=None, right=None):\n        self.val = val\n        self.left = left\n        self.right = right\n\ndef right_side_view(root):\n    \"\"\"\n    :type root: TreeNode\n    :rtype: List[int]\n    \"\"\"\n    # Your code here\n\n\n# Helper function to create a tree from a list\ndef create_tree(values):\n    if not values:\n        return None\n\n    root = TreeNode(values[0])\n    queue = [root]\n    i = 1\n    while queue and i < len(values):\n        node = queue.pop(0)\n\n        # Left child\n        if i < len(values) and values[i] is not None:\n            node.left = TreeNode(values[i])\n            queue.append(node.left)\n        i += 1\n\n        # Right child\n        if i < len(values) and values[i] is not None:\n            node.right = TreeNode(values[i])\n            queue.append(node.right)\n        i += 1\n\n    return root\n\n# Test cases\nprint(right_side_view(create_tree([1, 2, 3, None, 5, None, 4])))  # Should return [1, 3, 4]\nprint(right_side_view(create_tree([1, None, 3])))                 # Should return [1, 3]\nprint(right_side_view(create_tree([])))                           # Should return []\nprint(right_side_view(create_tree([1, 2])))                       # Should return [1, 2]"
    }
  }
}