{
  "id": 7,
  "title": "Subarray Sum Equals K",
  "difficulty": "Medium",
  "company": [
    "Meta"
  ],
  "tags": [
    "Array",
    "Hash Table",
    "Prefix Sum"
  ],
  "description": "Given an array of integers `nums` and an integer `k`, return the total number of **subarrays** whose sum equals to `k`.\n\nA **subarray** is a contiguous non-empty sequence of elements within an array.\n\n### Example 1\n\n**Input:** `nums = [1, 1, 1]`, `k = 2`  \n**Output:** `2`\n\n### Example 2\n\n**Input:** `nums = [1, 2, 3]`, `k = 3`  \n**Output:** `2`",
  "languages": {
    "python": {
      "starterCode": "def subarray_sum(nums, k):\n    \"\"\"\n    :type nums: List[int]\n    :type k: int\n    :rtype: int\n    \"\"\"\n    # Your code here\n\n\n# Test cases\nprint(subarray_sum([1, 1, 1], 2))     # Should return 2\nprint(subarray_sum([1, 2, 3], 3))     # Should return 2\nprint(subarray_sum([1, -1, 0], 0))    # Should return 3\nprint(subarray_sum([1, 2, 1, 2, 1], 3)) # Should return 4"
    }
  }
}