{
  "id": 20,
  "title": "Fibonacci Number",
  "difficulty": "Easy",
  "company": [
    ""
  ],
  "tags": [],
  "description": "The **Fibonacci numbers**, commonly denoted `F(n)` form a sequence, called the **Fibonacci sequence**, such that each number is the sum of the two preceding ones, starting from `0` and `1`. That is:\n\n`F(0) = 0`, `F(1) = 1`  \n`F(n) = F(n - 1) + F(n - 2)`, for `n > 1`\n\nGiven `n`, calculate `F(n)`.\n\n### Example 1\n\n**Input:** `n = 2`  \n**Output:** `1`  \n**Explanation:** `F(2) = F(1) + F(0) = 1 + 0 = 1`.\n\n### Example 2\n\n**Input:** `n = 3`  \n**Output:** `2`  \n**Explanation:** `F(3) = F(2) + F(1) = 1 + 1 = 2`.\n\n### Example 3\n\n**Input:** `n = 4`  \n**Output:** `3`  \n**Explanation:** `F(4) = F(3) + F(2) = 2 + 1 = 3`.",
  "languages": {
    "python": {
      "starterCode": "def fibonacci(n):\n    # Your code here\n    pass\n\n# Test cases\nprint(fibonacci(2))  # Should return 1\nprint(fibonacci(3))  # Should return 2\nprint(fibonacci(4))  # Should return 3\nprint(fibonacci(10)) # Should return 55"
    }
  }
}