{
  "id": 5,
  "title": "Merge Intervals",
  "difficulty": "Medium",
  "company": [
    ""
  ],
  "tags": [
    "Array",
    "Sorting"
  ],
  "description": "Given an array of `intervals` where `intervals[i] = [starti, endi]`, merge all **overlapping intervals**, and return an array of the non-overlapping intervals that cover all the intervals in the input.\n\n### Example 1\n\n**Input:** `intervals = [[1, 3], [2, 6], [8, 10], [15, 18]]`  \n**Output:** `[[1, 6], [8, 10], [15, 18]]`  \n**Explanation:** Since intervals `[1, 3]` and `[2, 6]` overlap, merge them into `[1, 6]`.\n\n### Example 2\n\n**Input:** `intervals = [[1, 4], [4, 5]]`  \n**Output:** `[[1, 5]]`  \n**Explanation:** Intervals `[1, 4]` and `[4, 5]` are considered overlapping.",
  "languages": {
    "python": {
      "starterCode": "def merge(intervals):\n    \"\"\"\n    :type intervals: List[List[int]]\n    :rtype: List[List[int]]\n    \"\"\"\n    # Your code here\n\n\n# Test cases\nprint(merge([[1,3],[2,6],[8,10],[15,18]]))  # Should return [[1,6],[8,10],[15,18]]\nprint(merge([[1,4],[4,5]]))                # Should return [[1,5]]\nprint(merge([[1,4],[0,4]]))                # Should return [[0,4]]\nprint(merge([[1,4],[2,3]]))                # Should return [[1,4]]"
    }
  }
}