{
  "id": 138,
  "title": "Copy List with Random Pointer",
  "difficulty": "Medium",
  "company": [
    "Meta"
  ],
  "tags": [
    "Hash Table",
    "Linked List"
  ],
  "description": "A linked list of length `n` is given such that each node contains an additional **random pointer**, which could point to any node in the list, or `null`.\n\nConstruct a **deep copy** of the list. The deep copy should consist of exactly `n` brand new nodes, where each new node has its value set to the value of its corresponding original node. Both the `next` and `random` pointer of the new nodes should point to new nodes in the copied list such that the pointers in the original list and copied list represent the same list state. None of the pointers in the new list should point to nodes in the original list.\n\nFor example, if there are two nodes `X` and `Y` in the original list, where `X.random --> Y`, then for the corresponding two nodes `x` and `y` in the copied list, `x.random --> y`.\n\nReturn the head of the copied linked list.\n\nThe linked list is represented in the input/output as a list of `n` nodes. Each node is represented as a pair of `[val, random_index]` where:\n\n- `val`: an integer representing `Node.val`\n- `random_index`: the index of the node (range from `0` to `n-1`) that the random pointer points to, or `null` if it does not point to any node.\n\nYour code will only be given the head of the original linked list.\n\n### Example 1\n\n**Input:** `head = [[7, null], [13, 0], [11, 4], [10, 2], [1, 0]]`  \n**Output:** `[[7, null], [13, 0], [11, 4], [10, 2], [1, 0]]`\n\n### Example 2\n\n**Input:** `head = [[1, 1], [2, 1]]`  \n**Output:** `[[1, 1], [2, 1]]`\n\n### Example 3\n\n**Input:** `head = [[3, null], [3, 0], [3, null]]`  \n**Output:** `[[3, null], [3, 0], [3, null]]`",
  "languages": {
    "python": {
      "starterCode": "# Definition for a Node.\nclass Node:\n    def __init__(self, x, next=None, random=None):\n        self.val = int(x)\n        self.next = next\n        self.random = random\n\ndef copyRandomList(head):\n    \"\"\"\n    :type head: Node\n    :rtype: Node\n    \"\"\"\n    # Your code here\n\n\n# Helper function to create a linked list with random pointers\ndef create_linked_list_with_random(values):\n    if not values:\n        return None\n\n    # Create nodes first\n    nodes = []\n    for val, _ in values:\n        nodes.append(Node(val))\n\n    # Connect nodes\n    for i in range(len(nodes) - 1):\n        nodes[i].next = nodes[i+1]\n\n    # Set random pointers\n    for i, (_, random_idx) in enumerate(values):\n        if random_idx is not None:\n            nodes[i].random = nodes[random_idx]\n\n    return nodes[0]\n\n# Helper function to convert a linked list with random pointers to a list\ndef linked_list_to_list_with_random(head):\n    if not head:\n        return []\n\n    # Map nodes to indices\n    node_to_idx = {}\n    curr = head\n    idx = 0\n    while curr:\n        node_to_idx[curr] = idx\n        curr = curr.next\n        idx += 1\n\n    # Create result list\n    result = []\n    curr = head\n    while curr:\n        random_idx = node_to_idx[curr.random] if curr.random else None\n        result.append([curr.val, random_idx])\n        curr = curr.next\n\n    return result\n\n# Test cases\nhead1 = create_linked_list_with_random([[7, None], [13, 0], [11, 4], [10, 2], [1, 0]])\ncopied1 = copyRandomList(head1)\nprint(linked_list_to_list_with_random(copied1))  # Should match input\n\nhead2 = create_linked_list_with_random([[1, 1], [2, 1]])\ncopied2 = copyRandomList(head2)\nprint(linked_list_to_list_with_random(copied2))  # Should match input\n\nhead3 = create_linked_list_with_random([])\ncopied3 = copyRandomList(head3)\nprint(linked_list_to_list_with_random(copied3))  # Should be []"
    }
  }
}