{
  "id": 4,
  "title": "Minimum Remove to Make Valid Parentheses",
  "difficulty": "Medium",
  "company": [
    ""
  ],
  "tags": [
    "String",
    "Stack"
  ],
  "description": "Given a string `s` of `'('`, `')'` and lowercase English characters.\n\nYour task is to remove the **minimum number** of parentheses (`'('` or `')'`, in any positions) so that the resulting parentheses string is **valid** and return any valid string.\n\nFormally, a parentheses string is valid if and only if:\n- It is the empty string, contains only lowercase characters, or\n- It can be written as `AB` (`A` concatenated with `B`), where `A` and `B` are valid strings, or\n- It can be written as `(A)`, where `A` is a valid string.\n\n### Example 1\n\n**Input:** `s = \"lee(t(c)o)de)\"`  \n**Output:** `\"lee(t(c)o)de\"`  \n**Explanation:** `\"lee(t(co)de\"` or `\"lee(t(c)ode)\"` would also be accepted.\n\n### Example 2\n\n**Input:** `s = \"a)b(c)d\"`  \n**Output:** `\"ab(c)d\"`\n\n### Example 3\n\n**Input:** `s = \"))((\"`  \n**Output:** `\"\"`  \n**Explanation:** An empty string is also valid.",
  "languages": {
    "python": {
      "starterCode": "def min_remove_to_make_valid(s):\n    \"\"\"\n    :type s: str\n    :rtype: str\n    \"\"\"\n    # Your code here\n\n\n# Test cases\nprint(min_remove_to_make_valid(\"lee(t(c)o)de)\"))  # Should return \"lee(t(c)o)de\" or equivalent\nprint(min_remove_to_make_valid(\"a)b(c)d\"))       # Should return \"ab(c)d\"\nprint(min_remove_to_make_valid(\"))((\"))          # Should return \"\"\nprint(min_remove_to_make_valid(\"(a(b(c)d)\"))     # Should return \"a(b(c)d)\" or equivalent"
    }
  },
  "priority": "High"
}