{
  "id": 3,
  "title": "LRU Cache",
  "difficulty": "Medium",
  "company": [
    "Meta"
  ],
  "tags": [
    "Hash Table",
    "Linked List",
    "Design"
  ],
  "description": "Design a data structure that follows the constraints of a **Least Recently Used (LRU) cache**.\n\nImplement the `LRUCache` class:\n- `LRUCache(int capacity)` Initialize the LRU cache with positive size capacity.\n- `int get(int key)` Return the value of the key if the key exists, otherwise return `-1`.\n- `void put(int key, int value)` Update the value of the key if the key exists. Otherwise, add the key-value pair to the cache. If the number of keys exceeds the capacity from this operation, evict the **least recently used** key.\n\nThe functions `get` and `put` must each run in `O(1)` average **time complexity**.\n\n### Example 1\n\n**Input:**\n```\n[\"LRUCache\", \"put\", \"put\", \"get\", \"put\", \"get\", \"put\", \"get\", \"get\", \"get\"]\n[[2], [1, 1], [2, 2], [1], [3, 3], [2], [4, 4], [1], [3], [4]]\n```\n**Output:**\n```\n[null, null, null, 1, null, -1, null, -1, 3, 4]\n```\n\n**Explanation:**\n```\nLRUCache lRUCache = new LRUCache(2);\nlRUCache.put(1, 1); // cache is {1=1}\nlRUCache.put(2, 2); // cache is {1=1, 2=2}\nlRUCache.get(1);    // return 1\nlRUCache.put(3, 3); // LRU key was 2, evicts key 2, cache is {1=1, 3=3}\nlRUCache.get(2);    // returns -1 (not found)\nlRUCache.put(4, 4); // LRU key was 1, evicts key 1, cache is {4=4, 3=3}\nlRUCache.get(1);    // return -1 (not found)\nlRUCache.get(3);    // return 3\nlRUCache.get(4);    // return 4\n```",
  "languages": {
    "python": {
      "starterCode": "class LRUCache:\n    def __init__(self, capacity):\n        \"\"\"\n        :type capacity: int\n        \"\"\"\n        # Your code here\n\n    def get(self, key):\n        \"\"\"\n        :type key: int\n        :rtype: int\n        \"\"\"\n        # Your code here\n\n    def put(self, key, value):\n        \"\"\"\n        :type key: int\n        :type value: int\n        :rtype: None\n        \"\"\"\n        # Your code here\n\n\n# Test case\ncache = LRUCache(2)\ncache.put(1, 1)\ncache.put(2, 2)\nprint(cache.get(1))       # Should return 1\ncache.put(3, 3)\nprint(cache.get(2))       # Should return -1\ncache.put(4, 4)\nprint(cache.get(1))       # Should return -1\nprint(cache.get(3))       # Should return 3\nprint(cache.get(4))       # Should return 4"
    }
  }
}